<?xml version="1.0" encoding="UTF-8"?>
<bridge xmlns:xsi="http://www.w3.org/2001/XMLSchema-instance" xsi:noNamespaceSchemaLocation="bridge.xsd">
  <customers>
    <customer id="114">
      <name>VOCWEBMANAGER DEV</name>
      <address>Address</address>
      <city>City</city>
      <zip>13132</zip>
      <state>137</state>
      <country>215</country>
      <county>County</county>
      <phone>5555</phone>
      <fax>5555</fax>
      <email>denis.nt@kttsoft.com</email>
      <contact>Denis Tukalenko</contact>
      <title>acceptance test</title>
      <trial_end_date>2010-01-01</trial_end_date>
      <period_end_date>2010-01-01</period_end_date>
      <deadline_counter>NULL</deadline_counter>
      <status>off</status>
      <limit>
        <limit_id>1</limit_id>
        <current_value>0</current_value>
        <max_value>50</max_value>
      </limit>
      <limit>
        <limit_id>2</limit_id>
        <current_value>0</current_value>
        <max_value>300</max_value>
      </limit>
      <limit>
        <limit_id>3</limit_id>
        <current_value>2</current_value>
        <max_value>2</max_value>
      </limit>
    </customer>
  </customers>
  <limits>
    <limit id="1">
      <name>MSDS</name>
      <increase_step>10</increase_step>
      <unit_type/>
      <type>limit</type>
    </limit>
    <limit id="2">
      <name>memory</name>
      <increase_step>100</increase_step>
      <unit_type>Mb</unit_type>
      <type>limit</type>
    </limit>
    <limit id="3">
      <name>Source count</name>
      <increase_step>1</increase_step>
      <unit_type/>
      <type>bplimit</type>
    </limit>
  </limits>
  <users>
    <user id="62">
      <username>kttsoft</username>
      <accessname>kttsoft</accessname>
      <password>d52b1b1763f67cf1d636d8e4ff11d058</password>
      <email>kttsoft@gmail.com</email>
      <phone>+38 067 7218938</phone>
      <accesslevel_id>3</accesslevel_id>
      <company_id>0</company_id>
      <facility_id>0</facility_id>
      <department_id>0</department_id>
    </user>
    <user id="70">
      <username>user1</username>
      <accessname>user1</accessname>
      <password>1b111411f1b95cfbf70d3ad478b247d9</password>
      <email>denis.nt@kttsoft.com</email>
      <phone>User1 [1-2]</phone>
      <accesslevel_id>0</accesslevel_id>
      <company_id>114</company_id>
      <facility_id>0</facility_id>
      <department_id>0</department_id>
    </user>
    <user id="72">
      <username>Facility</username>
      <accessname>user1facility</accessname>
      <password>28b904ca567a60a4e647b2502d83746c</password>
      <email>denis.nt@kttsoft.com</email>
      <phone>4242342</phone>
      <accesslevel_id>1</accesslevel_id>
      <company_id>114</company_id>
      <facility_id>0</facility_id>
      <department_id>0</department_id>
    </user>
    <user id="73">
      <username>Department</username>
      <accessname>user1department</accessname>
      <password>4cac0445519cb36fe00fb5e3d0fcc4cb</password>
      <email>denis.nt@kttsoft.com</email>
      <phone>545353</phone>
      <accesslevel_id>2</accesslevel_id>
      <company_id>114</company_id>
      <facility_id>0</facility_id>
      <department_id>0</department_id>
    </user>
  </users>
</bridge>
